Date,Country,Event
2020-02-12,United States,Centers for Disease Control and Prevention|CDC announces that a diagnostic kit it developed does not work. This kit was made available to certified laboratories in the United States besides being shared with more than thirty countries. Due to a possible problem with one of the reagents some results could be made inconclusive (neither positive nor negative).
2020-02-12,Germany,"According to the Deutsche Bank, the outbreak of COVID-19 may contribute to a recession in Germany."
2020-02-12,Russia,"Three people escape a quarantine facility in Russia. They did this because according to them, the conditions and officials of the quarantine were not good."
2020-02-12,Greece,"Cancellations in hotel bookings in the Greek island of Santorini have climbed up to 60-70% in the months of February and March, while there are fears of 100% cancellations for April."
2020-02-13,Other,WHO affirmed that the slowdown in the number of new infections should be taken cautiously as the situation can change in any direction.
2020-02-13,Vietnam,"A lockdown on Sơn Lôi Commune (Vĩnh Phúc Province, Vietnam) was implemented by the authorities after five investigated cases had been infected by a cluster. This would last until 3 March."
2020-02-13,Japan,Japan announced that a woman in her eighties outside of Tokyo has died. Two taxi drivers also were tested positive.
2020-02-13,China,A solo traveler from China was quarantined at Lackland Air Force Base in Texas.
2020-02-13,Portugal,"Champalimaud Foundation, a Portuguese private biomedical research foundation, announced the cancellation of a conference that was programmed to happen on 12 to 13 March."
2020-02-13,Other,European Union ministers of health held a meeting in Brussels.
2020-02-13,Cambodia,"The ship ''MS Westerdam'' was allowed to dock in Sihanoukville (city)|Sihanoukville, Cambodia."
2020-02-14,China,Portugal announced one more suspected case of a child of unspecified age that had returned from China.
2020-02-14,China,"In Bragança, Portugal|Bragança, Portugal, two Chinese college students agreed to stay on a voluntary quarantine when they return to Bragança. Although they did not show symptoms and neither had they been in contact with infected persons as far it was known, the reason for the quarantine was a recent holiday travel to China."
2020-02-14,United Kingdom,"In the United Kingdom, two Members of Parliament, Lilian Greenwood and Alex Sobel, self-quarantined after learning that they had attended a conference on 6 February where a confirmed case had also been in attendance."
2020-02-14,Germany,"A German citizen in Palma de Mallorca was released from hospital quarantine after he had been tested negative twice. Previously, he had tested positive for SARS-CoV-2 and was always asymptomatic."
2020-02-14,Egypt,The first case of coronavirus infection on the African continent was reported in Egypt.
2020-02-14,Singapore,"Grab (company)|Grab started GrabCare for healthcare workers in Singapore. This came after reports of increased discrimination due to the COVID-19 situation, making it difficult for healthcare workers to get rides."
2020-02-14,Japan,Japanese singer and voice actress Yui Ogura will now require attendees at her Valentine's Day event commemorating her fourteenth single to wear masks.
2020-02-14,Singapore,The Catholic Church of Singapore will suspend masses indefinitely from noon of 15 February in view of the coronavirus.
2020-02-15,United States,The United States announced it would evacuate Americans currently aboard the cruise ship Diamond Princess (ship)|''Diamond Princess''.
2020-02-16,Portugal,"The Portuguese Directorate General for Health announced it was compiling a list of hospitals in Portugal that might reinforce, if needed, the three hospitals already prepared to received patients. The list should have been ready by 17 February."
2020-02-16,Portugal,"According to the responsible of Portugal's medical emergency services (INEM), Portugal currently had four ambulances prepared to transport patients with the novel coronavirus to the referenced hospitals."
2020-02-17,United States,American passengers evacuate the Diamond Princess (ship)|''Diamond Princess'' and will return to the US. They will be held in quarantine for 14 days.
2020-02-17,China,Singapore will enforce Stay-Home Notices for all Singapore residents and long-term pass holders returning from China taking effect from 18 February. They will not be allowed to leave home during the next 14 days.
2020-02-17,Malaysia,"Following the confirmation of infection aboard the MS Westerdam|MS ''Westerdam'', the Malaysian authorities barred passengers who had traveled on the luxury cruise ship from entry."
2020-02-17,Japan,Naruhito|Japanese Emperor Naruhito's birthday ceremony and greetings to the public on 23 February will be cancelled.
2020-02-17,China,"The Israeli Ministry of Health (Israel)|Ministry of Health requested people returning from Asian countries and territories to self-quarantine. In the mention are mainland China, Taiwan, Macau, Hong Kong, Singapore, Thailand, South Korea and Japan."
2020-02-17,Other,"The Tokyo Marathon, due to take place on 1 March, will be restricted to elite runners and wheelchair athletes."
2020-02-17,Other,"The seventh episode of ''A Certain Scientific Railgun T'', \""Auribus oculi fideliores sunt. (The eyes are more trustworthy than the ears)\"", is replaced by a rerun of the sixth episode due to production delays associated with the virus outbreak."
2020-02-18,China,"Getty Images confirmed that it was protecting the identity of photojournalists in China \""due to worries about their safety\""."
2020-02-18,Japan,"Bushiroad, a Japanese entertainment company best known for creating the ''BanG Dream!'' and ''Revue Starlight'' multimedia franchises, announced that they would postpone and cancel several events up to 19 March due to the outbreak, and that they would offer refunds."
2020-02-18,Singapore,Singapore's Deputy Prime Minister and Ministry of Finance (Singapore)|Finance Minister Heng Swee Keat announced S$6.4 billion in reliefs to help businesses and citizens tide through the crisis.
2020-02-18,Other,"|access-date=20 March 2020 |website=The Straits Times |date=18 February 2020}}</ref> Of these, a S$4 billion Stabilisation and Support Package will be given to hard-hit businesses as well as for retraining workers,"
2020-02-18,Other,"|access-date=20 March 2020 |website=The Straits Times |date=18 February 2020}}</ref> with a S$1.6 billion Care and Support Package to help household expenses. An additional S$800 million will be set aside, especially for healthcare efforts."
2020-02-18,Singapore,"|access-date=20 March 2020 |website=The Straits Times |date=18 February 2020}}</ref> A planned Goods and Services Tax (Singapore)|Goods and Services Tax hike to 9% will not take place in 2021 owing to the economic impact, with a S$6 billion Assurance Package should the hike take effect."
2020-02-19,Other,"The Nipponbashi Street Festa in Osaka, a cosplay event described as the biggest of its kind, was cancelled due to concerns with the virus outbreak."
2020-02-19,Singapore,"Mediacorp, Singapore's main broadcaster, cancelled its Star Awards ceremony, initially scheduled for 26 April due to concerns over the ongoing outbreak."
2020-02-20,Other,"Macau reopened all casinos after a 15-day closure. However, all patrons and service staff would be required to wear masks as part of enhanced measures to reduce the virus spread."
2020-02-20,China,"Israel banned passengers who have been to China, Hong Kong, Thailand or Singapore in the previous 14 days."
2020-02-20,China,"In Novi Sanzhary, Ukraine, the buses carrying the evacuees from China were attacked by a mob hurling stones and engaging in violent clashes with the police."
2020-02-20,Iran,"Iraq halted travel to and from Iran after the number of cases spiked there. At the same time, travellers from Iran will not be allowed entry."
2020-02-21,Korea,"South Korea designated Daegu and Cheongdo County as \""special care zones\"", coming after a spike in cases reported. The government also announced plans to send military medical staff and temporary isolation facilities to stop the virus. In Seoul, large protests and demonstrations held on weekends would not be allowed. The military also banned all soldiers from taking leave, leaving the barracks and receiving guests. Residents in Daegu were advised to stay indoors, with commanders of a major US base imposing movement restrictions."
2020-02-22,Iran,"Kuwait halts flights to and from Iran, and imposed a ban on travellers arriving from Iran as a precaution. Any Kuwaiti returning will be isolated. In addition, authorities there advised against travel to Iran."
2020-02-22,Other,"Samsung shut its phone factory in Gumi until 24 February, with the floor the infected employee worked shut until 25 February. This comes after a cases was confirmed involving a worker there."
2020-02-22,Australia,"Australia announced an easing of travel restrictions for Chinese students in Year 11 or 12 except for those in Hubei, which will be considered on a case-by-case basis. The students will need to get approval from states and territories, as well as the schools involved. Similar exemptions for Chinese university students are being considered."
2020-02-23,Iran,Turkey shut down its border with Iran and banned all incoming flights as a precaution for stopping the spread of disease after Iran had reported 43 cases.
2020-02-23,Italy,"Italy introduces strict measures which place almost 50,000 people in lockdown in an attempt to control the virus. Fines are imposed on those caught entering or leaving outbreak areas."
2020-02-23,Korea,"South Korea raises its disease alert to the highest level, coming after the number of cases had continued to increase sharply."
2020-02-23,Korea,"Singapore expanded its health advisory to Daegu and Cheongdo in South Korea, advising travellers to \""avoid non-essential travel\"". At the same time, the definition of suspect cases was expanded to include travellers arriving from these two cities."
2020-02-23,Iran,Kuwait banned ships coming from Iran to stopping at its ports due to the coronavirus.
2020-02-23,Australia,"Israel extended its travel ban to Japan and South Korea taking effect the following day, following a previous travel ban that included Taiwan, Italy, Australia, and Macau."
2020-02-23,Taiwan,"Taiwan banned its healthcare professionals in hospital from travelling out to manage the shortage of workers amid the outbreak. Those who need to attend important meetings overseas have to seek permission. This comes after three local governments banned travel by public servants. In addition, military personnel are advised to avoid places affected by COVID-19, with quarantine imposed should they return from these places."
2020-02-24,Iran,Oman halted flights to and from Iran with immediate effect. This comes after its first confirmed case there.
2020-02-24,Germany,In Germany the Light + Building|Light + Building Trade Fair in Frankfurt was postponed until September.
2020-02-24,Iraq,"In Najaf, Iraq, mid-year exams which had already started will be cancelled until further notice to protect the health of students."
2020-02-24,Iran,UAE banned citizens from travelling to Iran and Thailand as a precaution against the coronavirus.
2020-02-24,Hong Kong,"Hong Kong bans travellers arriving from South Korea starting from 25 February at 6am. This comes after the number of cases there increased sharply. Authorities there have also advised against trips there, with a quarantine of 14 days imposed should Hong Kong residents arrive from Daegu and Cheongdo. Several tour groups have since cancelled trips there."
2020-02-24,Bahrain,"Six countries have since banned travellers from South Korea from entering their countries. They include Israel, Bahrain, Jordan, Kiribati, Samoa and American Samoa. Nine others have since placed restrictions."
2020-02-24,Korea,Mongolia will ban flights to South Korea starting from 25 February to 2 March.
2020-02-24,Taiwan,"Taiwan revises rules to require approval for healthcare professionals in hospital to travel to Level 1 and 2 countries, with a ban on travel to Level 3 countries."
2020-02-24,China,"Rock lobster deliveries from the US to China are on hold, and wedding dress orders in the US are not able to be fulfilled due to shortage of them as 80% of wedding dresses used in the US are made in China."
2020-02-25,China,"Iraq banned travellers from China, Iran, Thailand, South Korea, Japan, Italy, and Singapore from entering the country. Iraqis were also advised not to travel to these places."
2020-02-25,Bahrain,"Bahrain suspended all schools, nurseries and universities for two weeks to curb the spread of COVID-19 infection."
2020-02-25,Korea,"Singapore banned visitors arriving from Cheongdo and Daegu in South Korea from 26 February after cases had increased rapidly in these two cities. Singapore citizens, permanent residents and long-term pass holders returning from Cheongdo and Daegu within the last 14 days would be issued a Stay-Home Notice (SHN) lasting 14 days."
2020-02-25,Korea,"North Korea quarantined 380 foreigners, enacted a mandatory 30 day quarantine for all foreigners coming from outside the country and cancelled the Pyongyang Marathon."
2020-02-25,Japan,"Due to the coronavirus situation in Japan, organisers of the Asia's 50 Best Restaurants Awards decided to hold the ceremony online instead."
2020-02-25,United States,"In the United States, officials warned that community transmission of COVID-19 was expected, urging local governments, schools and businesses to develop plans to deal with potential outbreaks. In addition, disruptions to drug supplies could also be expected."
2020-02-25,Vietnam,"The Badminton World Federation announced it has postponed the Vietnam International Challenge tournament, originally scheduled to be held from 24 to 29 March."
2020-02-26,Japan,"Japanese prime minister Shinzo Abe called for sports and cultural events to be stopped for two weeks. This comes after Japan confirmed its second local death, amid concerns the 2020 Tokyo Olympics could be cancelled. Hokkaido will close schools from 27 February to 4 March, while Tokyo allowed schools to start some classes later."
2020-02-26,Japan,"As of this date the 2020 Tokyo Olympics shall go ahead as planned, albeit with some adjustments. This comes as major sports are being cancelled (or played behind closed doors, such as with the Japan Davis Cup); the Japan Sumo Association is weighing whether to cancel a sold-out sumo tournament scheduled for 8 March in Osaka."
2020-02-26,Japan,Toyota cancelled non-urgent trips for Japan workers as the coronavirus situation worsens. Its production schedule will remain unchanged.
2020-02-26,China,"Spain advised travellers to refrain from going to places like four Italian regions affected, Japan, Iran, South Korea, Singapore and China unless required. Measures will be put in place to slow the spread of the virus."
2020-02-26,China,"Thailand advised travellers to postpone trips to China, Hong Kong, Singapore, Italy, Macau, Taiwan, Iran and some areas in South Korea and Japan. Healthcare workers are not allowed to travel to places affected by COVID-19 unless absolutely necessary, with these workers asked to self-quarantine and adopt enhanced hygiene measures for 14 days."
2020-02-26,China,"The World Health Organisation reported that the number of new cases outside China had exceeded the number of new cases in China for the first time on 25 February, after a spike of cases in Italy, Iran and South Korea with cases in China dropping."
2020-02-26,Ireland,"Ireland's Six Nations Championship match with Italy, which was supposed to be held on the weekend of 6 to 8 March, has been postponed due to the coronavirus, and may be cancelled. This comes after a meeting with health officials led by Simon Harris (politician)|Simon Harris, the Health Minister."
2020-02-26,Germany,"The Badminton World Federation announced it has postponed the 2020 German Open (badminton)|2020 German Open and Polish Open tournaments, originally scheduled to be held from 3 to 8 March and 26 to 29 March respectively."
2020-02-26,Japan,AnimeJapan 2020 was cancelled.
2020-02-26,Other,Chinese authorities confiscated more than 31 million counterfeit surgical masks.
2020-02-27,Saudi Arabia,Saudi Arabia banned pilgrims and foreigners from entering the country due to the coronavirus.
2020-02-27,Fiji,"Fiji extends travel ban with Prime Minister Frank Bainimarama announcing that travellers who had been in Italy, Iran and the South Korean cities of Daegu and Cheongdo County|Cheongdo will be denied entry into Fiji. He also added that Thermographic camera|thermal scanners will be installed at the country's port of entry. From 28 February, all cruise ships entering Fiji would be required to make first berths at ports in Suva and Lautoka, where passengers will undergo a medical and travel history checks."
2020-02-27,Other,"Due to mounting worries about the coronavirus outbreak, various U.S. Stock market index|stock market indices including the NASDAQ-100, the S&P 500 Index, and the Dow Jones Industrial Average posted their sharpest falls since 2008, with the List of largest daily changes in the Dow Jones Industrial Average|Dow falling 1,191 points, its largest one-day drop since the Financial crisis of 2007–08|2008 financial crisis."
2020-02-27,Japan,"Japan's Prime Minister Shinzo Abe requested all elementary, junior high, high and special needs schools to close from 2 March until spring break in a bid to stop the virus."
2020-02-27,Greece,"Following the confirmation of the 2nd and 3rd case in Greece, the Health Minister announced that all carnival celebrations in the country will be suspended."
2020-02-27,Australia,"Australia drew up a pandemic plan in preparation of a bigger spread. It also extended a travel ban on travellers coming from China until 7 March, the third time it has done so."
2020-02-27,Other,"The World Health Organisation urged countries not to assume that they will be spared the coronavirus, pointing out that it would be a \""fatal mistake\"" to do so. It also warned that the virus \""has pandemic potential\""."
2020-02-27,China,"Iran cancelled Friday prayers in some cities. Iran has since banned travellers from China entering the country. A ban on conferences, cultural events and closure of cinemas was extended by another week."
2020-02-27,Other,"Facebook cancelled the F8 developer conference, which was supposed to be held on 5–6 May."
2020-02-27,Italy,British Airways cancels 56 flights to Italy between 14 and 26 March due to the large amount of cancellations.
2020-02-27,Taiwan,Taiwan raised its alert level to the highest after sporadic cases of transmission.
2020-02-27,Other,The Asian Football Confederation announced the postponement of 8 matches of the 2020 AFC Champions League group stage|Champions League group stage originally scheduled for 2–4 March.
2020-02-28,Iran,"In response to New Zealand's first reported case, the New Zealand Government temporarily banned travelers from Iran. The patient had reportedly returned from Iran to Auckland earlier in the week. While New Zealand citizens and permanent residents will be allowed to return, they must self-isolate for 14 days. In addition, the Minister of Health (New Zealand)|Health Minister David Clark confirmed that Chinese international students would not be allowed to re-enter the country and that there would be an increased health presence at airports."
2020-02-28,Cyprus,"Cyprus decided to close four checkpoints on the divided island for a week starting 29 February — the first closure since the crossings between the two sides were eased in 2003 after decades of disputes. The United Nations peacekeeping force on the island, UNFICYP were informed of the decision."
2020-02-28,Other,Tokyo Disneyland and Tokyo DisneySea will close from 29 February to 15 March to limit the spread of the virus.
2020-02-28,Iran,"Malaysia banned all travellers arriving from South Korea with immediate effect. In addition, Malaysians, permanent residents, and long-term social visit pass and student pass holders returning from Daegu or Cheongdo in the last 14 days must undergo health screening, and separate immigration lanes for travellers from South Korea, Japan, Italy and Iran will be set up."
2020-02-28,Korea,"South Korean band BTS (band)|BTS cancelled their April 2020 ''Map of the Soul Tour'' scheduled to be held at the Seoul Olympic Stadium. The band's label Big Hit Entertainment released a statement that is \""impossible at this time to predict the scale of the outbreak\"" and that they \""must take into consideration the health and safety of hundreds of thousands of guests as well as our artists.\"""
2020-02-28,Iran,"According to BBC, internal sources in the Iranian health system stated that at least 210 COVID-19 patients have died in Iran."
2020-02-28,Other,Shopify cancelled the Shopify Unite Conference which supposed to be held on 6 to 8 May in Toronto.
2020-02-28,Switzerland,"The Geneva Motor Show scheduled to start on 5 March in Switzerland is cancelled. This comes after Switzerland banned public gatherings of more than 1,000 people to contain the virus."
2020-02-28,Russia," In Russia, 88 foreigners in Moscow will be deported for breaking quarantine."
2020-02-28,Other,"The Game Developers Conference, which was set to take place in March, has been postponed to an undisclosed date in the summer."
2020-02-28,Japan,"Japan's Hokkaido declared a state of emergency until 19 March as the number of cases continued to rise, with people asked to stay indoors."
2020-02-28,Other,The World Health Organisation raised the coronavirus alert to the highest level. This comes after more countries confirmed their first cases with the outbreak reaching sub-Saharan Africa.
2020-02-28,Korea,A Hyundai Motor Company|Hyundai factory in Ulsan in South Korea shut down after a case was confirmed involving a worker there.
2020-02-28,United States,"In the United States, a school in Washington (state)|Washington and another in Oregon, will be temporarily closed."
2020-02-28,Japan,"In Japan, authorities asked online auction sites to stop listing face masks, in an effort to prevent mask shortages caused by people buying face masks in bulk to sell them in online auctions."
2020-02-29,Korea,"Vietnamese authorities announced the visa-free policy for Korean citizens to be temporarily invalidated, starting 29 February. Also, medical quarantine was imposed for Korea-related passengers who arrive in Vietnam."
2020-02-29,China,Nasa releases new satellite images over China that show air pollution has decreased a large amount due to reduced travel and industrial facilities being closed.
2020-02-29,Iran,"The United States bans travel from Iran, and increases its travel warnings to Italy and South Korea."
2020-02-29,Iran,"Iran bans the exporting of soaps, bleaches, and disinfectants to try to reduce shortages."
2020-02-29,Azerbaijan,Azerbaijan shuts down its border with Iran.
2020-02-29,Other,"The ASEAN Summit|US-ASEAN Summit in Las Vegas on 14 March, between the U.S. President and ten leading representatives of Association of Southeast Asian Nations|Southeast Asian countries, was postponed."
2020-02-29,Iran,"An Iranian Member of Parliament, Mohammad Ali Ramazani, has died due to the coronavirus."
2020-02-29,Portugal,"According to Portugal's General Directorate of Health, Graça Freitas, in the worst-case scenario, Portugal may have one million infections (in a population of roughly more than ten million) over several months of outbreak, 12 to 14 weeks of intense contagion and around 20% severe cases of the total infected population. In this scenario the mortality rate may be around 2.3% to 2.4%. In the most probable scenario is it estimated that Portugal will have around twenty one thousand cases in the most severe week of the outbreak."
2020-02-29,France,"France temporarily banned gatherings of more than 5,000 people to contain the virus, coming after new cases are reported. As a result, the Paris half-marathon is cancelled, and the annual farm show will end today instead."
2020-02-29,Australia,Australia will ban travellers arriving from Iran starting 1 March. Travellers who do so will be required to stay in another country for 14 days.
2020-02-29,United Arab Emirates,The United Arab Emirates suspends all extracurricular school activities and orders nurseries closed until further notice as measures to prevent the spreading of the virus.
2020-02-29,Japan,Several cherry blossom festivals in Japan were cancelled due to fears of the coronavirus spreading uncontrollably.
2020-02-29,Hong Kong,"In Hong Kong, several small surgical mask factories began mass production."
