Date,Country,Event
2020-02-01,Australia,"Australia's Department of Health (Australia)|Department of Health issued directives, going into effect from 1 February. Accordingly, travel advisory was increased to level 4: do not travel to all of mainland China. All travellers arriving out of mainland China were asked to self-isolate for a period of 14 days from the time of leaving. Additional border measures were implemented to deny entry of people who have arrived from the mainland China, with the exception of Australian citizens, permanent residents and their immediate family and air crews who have been using appropriate personal protective equipment."
2020-02-01,China,"International border gates Móng Cái (Quảng Ninh Province, Vietnam) - Dongxing, Guangxi|Dongxing (Guangxi, China) ceased functioning on 1 February for an unspecified time; border gates Hoành Mô and Bắc Phong Sinh experienced a 24-hour closure, awaiting further measurements from authorities."
2020-02-01,China,"Taiwan barred nationals from Guangdong (mainland China) and travellers who recently visited the area will be subject to a mandatory 14-day quarantine, from entry beginning 1 February."
2020-02-01,Vietnam,"With the sixth case being another domestic transmission, Vietnamese Prime Minister Nguyễn Xuân Phúc signed an epidemic declaration."
2020-02-01,India,India banned the export of N95 masks with immediate effect.
2020-02-01,Japan,"The Government of Japan barred: entry of foreign nationals infected with the virus, and entry of Chinese citizens with passports issued in Hubei province."
2020-02-01,Germany,"102 German citizens and 26 relatives, all of whom were symptom-free on departure, were evacuated from the Wuhan region to Frankfurt am Main by the Executive Transport Wing (German Air Force)|Executive Transport Wing of the German Air Force. After their return, they were placed in quarantine in a military barrack in Rhineland-Palatinate for 14 days."
2020-02-01,Canada,"Trinidad and Tobago's travel restrictions on persons arriving from China goes into full effect. Persons now have to wait 14 days after leaving China before being able to enter Trinidad & Tobago. Additionally persons who may already be at a port of entry and who were in China or are showing symptoms will be subject to quarantine measures. Thermal screening is also being conducted on passengers arriving from Canada, Panama, the United Kingdom and the United States. Testing will also be done by the Caribbean Public Health Agency (CARPHA) on 3 February."
2020-02-01,China,Qatar Airways has suspended flights to mainland China from 3 February until further notice.
2020-02-01,China,Princess Cruises announces restrictions on crew members and guests who have recently travelled within mainland China. Guests who have traveled through or in mainland China 14 days prior to the scheduled departure of their cruise will not be allowed to board. Crew members from mainland China are prohibited from getting on any ship until further notice from the company. Crew members scheduled on connecting flights to China have been rerouted. Two cruises in June have been cancelled and two cruises have been rerouted to arrive or depart in Tokyo instead of Shanghai.
2020-02-02,China,"New Zealand has temporarily banned all foreign nationals travelling from, or transiting through mainland China after 2 February to assist the containment of the coronavirus into New Zealand and the Pacific Islands. Foreign travelers in transit to New Zealand on 2 February will be subject to enhanced scanning but pending clearance will be allowed into New Zealand. New Zealand citizens and permanent residents, and their immediate family members, will be allowed to enter New Zealand but must self-isolate for 14 days. The ban will last for 14 days but will be reviewed every 48 hours."
2020-02-02,China,"The Philippines has temporarily banned foreigners arriving from China and its territories, including those who visited such areas within the past 14 days, from entering the country; Filipino citizens and permanent residents of the Philippines arriving from such would have to undergo quarantine for 14 days. Travel from Philippines to China and its territories have been temporarily banned as well."
2020-02-02,Korea,"According to a diplomatic note distributed to foreign residents in North Korea, North Korean authorities have suspended the flight route between Pyongyang and Vladivostok performed by Air Koryo’s."
2020-02-02,Korea,"South Korean Prime Minister Chung Sye-kyun announced to the public the entry barring of all foreign nationals, who have been to Hubei Province since 21 January, will go into effect starting 4 February for an unspecified time. Also, the visa-free policy for Chinese citizens to visit Jeju Island is to be temporarily nullified."
2020-02-02,China,Indonesia banned all flights from and to Mainland China starting from 5 February. The government also stopped giving free visa and visa on arrival for Chinese nationals. They banned those who live or stay in Mainland China for at least 14 days before from entering or transiting Indonesia. Indonesians are discouraged from travelling to China.
2020-02-02,Vietnam,"The Vietnamese Ministry of Labour, Invalids and Social Affairs (Vietnam)|Ministry of Labors, Invalids and Social Affairs issued directive on temporary suspension to Chinese labours returning to work after public holidays."
2020-02-02,United Arab Emirates,"Numerous landmark buildings in the United Arab Emirates lit up a Sunday night showing support for Wuhan and Chinese communities around the world over pain and horror by the novel coronavirus, namely: the Burj Khalifa, ADNOC Headquarters, the Capital Gate, Abu Dhabi Global Market, Emirates Palace, Sheikh Zayed Bridge, Burj Al Arab, Hazza bin Zayed Stadium, etc."
2020-02-02,China,"AirAsia Philippines, Philippine Airlines and Cebu Pacific, has suspended flights to and from mainland China, Macau and Hong Kong."
2020-02-02,Other,Group of Seven countries are seeking a unified approach to combat the spread.
2020-02-03,China,The Government of Maldives denies entry to passengers arriving from China.
2020-02-03,Hong Kong,"Hong Kong announced further tightening of border with the mainland. Beginning 00:00 on 4 February, the special administrative region closed most of its border crossings, except  the Hong Kong International Airport, the Shenzhen Bay Port and the Hong Kong-Zhuhai-Macau Bridge."
2020-02-03,China,Indonesia set to ban live animal imports from China as coronavirus fears grow.
2020-02-03,Japan,"The Japanese authorities denied entry to any foreign nationals who have been to Hubei province in the past 14 days, even if there is no symptoms of the virus."
2020-02-03,Venezuela,"The Venezuelan government announced that the country has imposed epidemiological surveillance, restrictions and diagnostic system to detect possible coronavirus patients at the Simón Bolívar International Airport (Venezuela)|Simón Bolívar International Airport in Maiquetía, Venezuela's main international airport, and that Venezuela will receive a diagnostic kit for the virus strain from the Pan American Health Organization (PAHO)."
2020-02-03,Other,Lunar New Year holidays was extended for one week to all K-12|k-through-12 students in Ho Chi Minh City; public schools will resume on 10 February.
2020-02-03,China,"The global Cruise Lines International Association bans trips to mainland China and says that it \""will deny boarding to any individual, whether guest or crew, who has travelled from or through mainland China within the previous 14 days.\"""
2020-02-03,China,Boise State University suspends travel to and from China.
2020-02-03,Other,"At a news briefing, The Centers for Disease Control and Prevention plan to distribute testing kits to speed up the diagnosis of the coronavirus. The CDC states that this measure will help speed up the testing and diagnosis of the coronavirus after cases in the U.S. reached 11. The Food and Drug Administration first has to approve the test for wider distribution, the CDC said."
2020-02-03,India,India invalidated all e-visas given to Chinese passport holders since 15 January. It also has stopped giving out new e-visas to Chinese passport holders.
2020-02-03,Korea,Several exhibitors and South Korea's Black Eagles have decided to pull out of the Singapore Airshow. This comes as the virus situation worsens.
2020-02-03,Singapore,"|access-date=24 February 2020 |website=The Straits Times |date=3 February 2020}}</ref>K-pop band Winner (band)|Winner cancelled its concert in Singapore, supposed to be held on 8 February. Several Huayi events in Esplanade – Theatres on the Bay|Esplanade were cancelled owing to travel restrictions. In addition, a Stage Club play was postponed."
2020-02-04,China,"|access-date=24 February 2020 |website=The Straits Times |date=3 February 2020}}</ref>The President of Federated States of Micronesia, David Panuelo, declared a state of emergency. Accordingly, Micronesian citizens are banned from visiting mainland China. Anyone who had been in mainland China from 6 Jan were barred from entering the country."
2020-02-04,Iran,Iran bans exports of facial masks to reduce shortages as domestic use increases significantly.
2020-02-04,Other,"The Beijing–Nanning–Hanoi through train|Nanning–Hanoi through train shall cease service as per agreement between the two national operators. Accordingly, the last train from Nanning railway station departed at 18:05 4 February, and the last from Gia Lâm railway station at 21:20 5 February."
2020-02-04,Other,The city government of Macau ordered a shut down of all casinos for at least 15 days.
2020-02-04,China,"The United Kingdom directed its citizens to leave China if possible. Foreign Secretary Dominic Raab said, \""We now advise British Nationals in China to leave the country if they can, to minimise their risk of exposure to the virus.\"""
2020-02-04,Israel,The Knesset in Israel is forming a special committee to deal with coronavirus.
2020-02-04,China,"Cathay Pacific|Cathay Pacific Airways, the flag carrier of Hong Kong, announces that it is ceasing 90% of its flights to mainland China."
2020-02-04,Hong Kong,"Royal Caribbean Cruises cancels more ships and adds Hong Kong on the No-Board list. This goes beyond what the Cruise Lines International Association had done, the day before."
2020-02-04,Hong Kong,"Princess Cruises confirmed quarantine of the Diamond Princess (ship)|Diamond Princess carrying about 3,700 people after one of its passengers tested positive in a  Hong Kong hospital,"
2020-02-04,Other,"Hyundai Motor Group|Hyundai, blaming a parts shortage due to the effects of coronavirus infection, announces it will shut down some production."
2020-02-04,Hong Kong,"Air India announces that starting from 8 February, they will temporarily suspend flights to Hong Kong."
2020-02-04,Singapore,An aviation conference during the Singapore Airshow is cancelled to allow leaders to deal with the coronavirus. This comes after 16 exhibitors pulled out of the Airshow.
2020-02-05,Hong Kong,|access-date=24 February 2020 |website=The Straits Times |date=4 February 2020}}</ref>United Airlines and American Airlines suspended US flights to and from Hong Kong.
2020-02-05,United States,"Hundreds more Americans were evacuated by two planes from Wuhan to the United States, landing in this case at Travis Air Force Base near Sacramento, California. One of the planes would continue on to Marine Corps Air Station Miramar in San Diego. All evacuees would undergo a two-week quarantine. \""Inbound evacuation flights to Wuhan were using their cargo space to deliver donated medical supplies for coronavirus relief efforts.\"""
2020-02-05,China,Hong Kong announced the beginning of a mandatory two-week quarantine for all visitors from mainland China or Macau.
2020-02-05,China,"Taiwan banned entry of non-citizens who have been to mainland China, Hong Kong or Macau within the past 14 days."
2020-02-05,Colombia,"With the US CDC's endorsement, Colombia INS confirmed that it to be the first country in Latin America that might detect the novel coronavirus without sending samples to foreign centers."
2020-02-05,Canada,"Canadian Minister of Foreign Affairs (Canada)|Minister of Foreign Affairs François-Philippe Champagne advised all Canadians in China but outside the quarantine zone to leave the country \""via commercial means\""."
2020-02-05,China,"India starts scanning passengers in flights coming from  Singapore and  Thailand, along with further travel restrictions on  China to prevent the spread of the virus."
2020-02-05,Other,"The Bill & Melinda Gates Foundation committed over $100 Million for better detection, isolation, and treatment research for the virus."
2020-02-05,China,"Yum China Holdings temporarily closed 30% of all Pizza Hut's and KFC's that they operate in China, due to the virus epidemic."
2020-02-05,Other,"Tesla, Inc.|Tesla stated that due to the virus epidemic, there would be a delay in the shipment of their Tesla Model 3 car, as they are produced and assembled in a new plant at Shanghai."
2020-02-05,Other,"World Health Organization (WHO) stated that there had been a large surge in new cases in the 24 hour period, of an amount that had not been seen in any day since the start of the epidemic."
2020-02-05,Other,"Countering rumors in the media, the World Health Organization|WHO stated that there are no known therapeutics, drugs, or treatments that are effective for the virus yet."
2020-02-06,Korea,"A business meeting held in mid-January 2020 at the Grand Hyatt in Singapore of an unnamed international sales company resulted in the infection of four persons in attendance: one from Malaysia, one from Korea and two from Singapore."
2020-02-06,Australia,"Virgin Australia announced the permanent cancellation of its Hong Kong routes, citing the coronavirus outbreak and anti-government protests."
2020-02-06,Hong Kong,Taiwan suspended visas for Hong Kong and Macau citizens.
2020-02-06,China,The Singapore government stated that a 14-day leave of absence would be mandatory for all workers who return from China.
2020-02-06,Hong Kong,Panic buying of consumer goods was reported in Hong Kong due to rumors of an impending quarantine.
2020-02-06,France,"Virgin Atlantic|Virgin, KLM, Air France, American Airlines (not including the  Hong Kong route), and Iberia (airline)|Iberia extended their current flight suspensions till sometime in March."
2020-02-06,China,Volvo stated that two plants in China were still not reopened and will reopen after a few more weeks.
2020-02-06,Other,Shinzo Abe stated that the 2020 Summer Olympics would not be postponed.
2020-02-06,Canada,Canada started the evacuation of its citizens from Wuhan.
2020-02-06,Other,"The Better Business Bureau warned about face mask scams that attempt to use the ongoing fears and make false claims.  The scams will either give low-quality or incorrect masks, or will send no mask at all when paid."
2020-02-06,Other,"The Pentagon was asked by the Department of Health and Human Services (HHS) to provide  military installations near 11 major airports that could each house up to 220 U.S. citizens in support of coronavirus quarantines. The DoD facilities and the airports they could support include:  Joint Base Pearl Harbor-Hickam, Hawaii, near Honolulu International Airport; Great Lakes Training Center Navy Base, Ill., by Chicago's O'Hare International Airport; Naval Air Station Joint Reserve Base, Texas, close to Dallas/Fort Worth International Airport; March Air Reserve Base (ARB), Calif., by Los Angeles International Airport; Travis Air Force Base (AFB), Calif., near San Francisco International Airport; Dobbins ARB, Ga., near Hartsfield–Jackson Atlanta International Airport; Fort Hamilton, N.Y., by John F. Kennedy International Airport; Naval Base Kitsap, Wash., near Seattle-Tacoma International Airport; Joint Base Anacostia-Bolling, D.C., by Dulles International Airport; Joint Base McGuire-Dix-Lakehurst, N.J., by Newark Liberty International Airport; and Fort Custer Training Center, Mich., near Detroit Metropolitan Airport."
2020-02-06,Other,"Professor Neil Ferguson, director of the MRC Centre for Global Infectious Disease Analysis at Imperial College London is summarized in a news report as saying \""that the true scale of the coronavirus isn't being reported by Chinese officials and claims that around 50,000 new cases are emerging in the country daily.\"""
2020-02-06,Singapore,Welsh singer Novo Amor postponed a concert in Singapore to July.
2020-02-07,United States,|access-date=24 February 2020 |website=The Straits Times |date=6 February 2020}}</ref>The White House asked scientists in the US to investigate the origins of the virus. One of the reasons for this was because of the large amount of misinformation that is available about the virus online.
2020-02-07,China,Many colleges across the world were starting to reconsider and look into reviewing current student plans for Study abroad programs to and/or from China. This was due to the health safety for the students.
2020-02-07,Singapore,"The third British citizen who contracted coronavirus did so through travel to  Singapore. \""The government is now telling travellers arriving in the UK from a total of nine Asian countries and territories to check for symptoms. They are advised to stay at home and call the NHS if they are ill and have flown home in the past 14 days.\"""
2020-02-07,Singapore,"Singapore raises its contagion threat level to Orange, as the virus is spreading there from unknown origins."
2020-02-07,Hong Kong,"Two Hong Kong jewelry trade fairs, hosted by the Hong Kong Trade Development Council, got rescheduled due to the virus epidemic."
2020-02-07,Canada,"The Canadian evacuation plane landed in British Columbia for refueling. The plane was also carrying Chinese nationals and citizens who have valid visas for Canada, these were for escorting Canadian minors. The planes final destination is CFB Trenton."
2020-02-07,Other,"Continuing the evacuation of American citizens from Wuhan, a rescue plane is landing in Omaha, Nebraska today."
2020-02-07,Hong Kong,"Royal Caribbean International|Royal Caribbean cruise lines bans Chinese, Hong Kong and Macau passport holders, as well as travelers who have been in those locales within the last 14 days."
2020-02-07,China,The United States announced aid of up to $100 million for China and other nations affected by the new coronavirus.
2020-02-07,Canada,The first Canadian evacuation plane lands at its final destination.
2020-02-07,Other,Honda shuts down 3 of its plants around the Wuhan region area till 13 February.
2020-02-07,United States,The Federal Reserve Bank warns that the virus is a potential threat to the growth of the US economy.
2020-02-07,China,VF Corporation announces that its subsidiary Vans has temporarily closed 60% of all its stores in China.
2020-02-07,China,Burberry temporarily closes a third of their stores in China.
2020-02-07,India,India offers to test samples for other Southeast Asian countries.
2020-02-07,Other,"Nvidia withdraws from the Barcelona Mobile World Congress by informing the GSMA, due to the threat of the virus."
2020-02-07,Singapore,"98 Degrees postponed its Singapore concert due to the coronavirus, which was supposed to be held on 20 February."
2020-02-07,Other,"Performances of First Fleet, a Mandarin play originally planned from 14 to 23 February, were  rescheduled to March 2021."
2020-02-07,Singapore,"Lockheed Martin and Raytheon decided to pull out of the Singapore Airshow as coronavirus fears have caused event turnout to drop. Meanwhile, the United States Department of Defense reduced the size of its delegation for the Airshow."
2020-02-08,Vietnam,"The school break in Vietnam was extended in all 63 first-level subdivisions, with the majority to 16 February and five to an unspecified time."
2020-02-08,China," |title=63/63 tỉnh, thành phố kéo dài thời gian nghỉ học cho học sinh |last= |date= |website=tuoitre.vn |language=vi |access-date=8 February 2020 |trans-title=63/63 cities and provinces to extend the school break for students}}</ref>Apple Inc.|Apple extends the shutdown period of its stores and corporate offices in China.  They will reopen at some time during the week of 10 February which is the week after the originally stated week Apple said they will reopen."
2020-02-08,Hong Kong,"Norwegian Cruise Line bans Chinese, Hong Kong, and Macau passport holders, or any one who visited these regions in the past 30 days."
2020-02-08,Other,Hyundai Motor Group|Hyundai has shut down its largest factory due to lack of wiring that connects the electronic systems in its cars.
2020-02-08,Indonesia,"Indonesia advised travellers to take precautions and be alert while in Singapore, with the government raising the travel alert to Yellow, the second out of three tiers."
2020-02-09,Kuwait,The Kuwait|Kuwaiti Embassy in Singapore called its citizens to delay their travel plans after the Singaporean government raised the coronavirus alert level to Code Orange.
2020-02-09,Malaysia,Malaysia expands their Chinese traveler ban to include the provinces of Zhejiang and Jiangsu.
2020-02-09,France,Families in the French village Les Contamines-Montjoie get lined up to get tested for the virus.
2020-02-09,Hong Kong,"Israel has advised travellers to delay travel to countries and territories hit by the coronavirus. In the mention are Singapore, Thailand, South Korea, Japan, Taiwan, Macau and Hong Kong."
2020-02-10,Other,"Amazon (company)|Amazon, Sony, and Ericsson states that they will not partake in the Barcelona Mobile World Congress due to the virus."
2020-02-10,Other,The virus daily death toll reaches a new record of 97 people dead from the virus in a single day.
2020-02-10,Other,Asian stock markets fell and went into red due to investor fears relating to the virus impact on the economy.
2020-02-10,Brazil,"The plane that was taking people who lived in Brazil or were citizens back home landed in Brazil. The people on the aircraft were taken into quarantine.  Before landing in Brazil, that plane landed in Poland, as the plane when it left China were also taking 6 people back to Poland."
2020-02-10,Singapore,"HSBC Women's World Championship, LPGA Tour Championship, and LPGA cancelled two more events overall within Singapore and Thailand due to the virus.  Thus meaning only two more events remain uncancelled."
2020-02-10,Singapore,The United Kingdom included Singapore in a list of countries where travelers returning are advised to self-isolate if they have symptoms as a precautionary measure.
2020-02-10,Singapore,Sarawak imposed a 14-day quarantine for travelers coming from Singapore in a bid to slow down the spread of the coronavirus. This comes after Singapore's DORSCON was raised to Orange on 7 February.
2020-02-10,Singapore,Over 70 exhibitors have decided to withdraw or not take part in the Singapore Airshow due to the virus.
2020-02-10,Japan,"An event commemorating the release of Japanese voice actress Miku Itō's sixth single, the theme song for the anime ''Plunderer (manga)|Plunderer'', is delayed by her record label Nippon Columbia due to concerns about the outbreak."
2020-02-11,Singapore,"The Global Grain Conference that was going to take place in Singapore, has been postponed to sometime in June and/or July, due to the virus."
2020-02-11,Hong Kong,"Authorities in Hong Kong evacuate a Tsing Yi Estate apartment building, after two residents who lived separately got diagnosed with the virus."
2020-02-11,China,"The virus is lowering crude prices worldwide, as China's demand for crude oil decreases due to shutdowns, lockdowns, fears, and other measures."
2020-02-11,China,"South Korea has advised travellers to delay travel to countries and territories hit by the coronavirus; mentioned are Singapore, Malaysia, Thailand, Vietnam, Japan, and Taiwan in addition to mainland China."
2020-02-11,Hong Kong,"Taiwan urged travellers to take precautions when travelling to Singapore or Thailand, and to avoid Hong Kong or Macau unless absolutely necessary."
2020-02-11,Malaysia,Singapore and Malaysia will form a joint working group to prevent and control the coronavirus infection.
2020-02-11,Thailand,"The Thailand public health minister does not allow a Holland America Line|Holland America cruise ship, ''MS Westerdam'' to disembark in the country.  The reason cited by the public health minister is that there are 32 cases in Thailand."
2020-02-11,China,"During a live broadcast on the Fox Business Network, anchor Maria Bartiromo suggests China developed COVID-19 as a biological weapon of mass destruction and deliberately attempted to infect United States diplomats at the White House and in Davos, Switzerland."
2020-02-12,China,American Airlines extend their flight suspensions to Hong Kong and China through some point in late April.
2020-02-12,Other,The WHO states that the Coronavirus vaccine could be ready in approximately 18 months.
2020-02-12,Austria,"The United States Postal Service, Singapore Post, PostNord Sverige, and Austrian postal services will temporarily stop sending mail or other postal services to China, and/or Hong Kong as well as Macau. This is due to the available flight shortages and flight suspensions, which is making it hard to send mail to China, Hong Kong, and Macau."
2020-02-12,China,Bulgari CEO states that half of its stores in the greater China region have been temporarily closed due to the virus.
2020-02-12,Other,"The Formula 1 Chinese Grand Prix 2020 which is set to held in April, was postponed to a later date due to the outbreak."
2020-02-12,Other,The Dalai Lama announced he stopped all public engagement due to the outbreak.
2020-02-12,Other,"The Mobile World Congress (MWC), due to start on 24 February, is cancelled."
